{
  "schema_version": "1.0",
  "mission_id": "example-agent-mission",
  "state": "review_required",
  "last_run_id": "example-agent-run",
  "human_review_required": true,
  "allowed_next_actions": [
    "review_plan_proposal",
    "record_human_approval",
    "preview_controlled_tool_execution"
  ],
  "blocked_actions": [
    "repository_apply",
    "git_stage",
    "git_commit",
    "git_push",
    "private_context_access",
    "autonomous_mission_closure"
  ]
}